{
  "$schema": "https://raw.githubusercontent.com/byteowlz/schemas/refs/heads/main/ctx/ctx.bundle.schema.json",
  "schema_version": 1,
  "id": "2026-06-24T09-12-55Z_a1b2c3_generic-pi-handoff",
  "created_at": "2026-06-24T09:12:55Z",
  "updated_at": "2026-06-24T09:13:40Z",
  "state": "draft",
  "slug": "generic-pi-handoff",
  "producer": { "name": "ctx" },
  "items": [
    {
      "id": "txt_task",
      "created_at": "2026-06-24T09:12:56Z",
      "kind": "text",
      "role": "task",
      "storage": "inline",
      "text": "Investigate why the build fails on CI and propose a fix."
    },
    {
      "id": "snap_1",
      "created_at": "2026-06-24T09:13:10Z",
      "kind": "desktop_snapshot",
      "path": "snapshots/desktop.json",
      "format": "ctx-capture-envelope",
      "note": "Captured displays, windows, and accessibility tree."
    },
    {
      "id": "url_1",
      "created_at": "2026-06-24T09:13:20Z",
      "kind": "url",
      "url": "https://ci.example.com/job/ctx/123",
      "title": "ctx #123 - failed",
      "source": { "app": "Safari", "window_title": "ctx #123 - failed" }
    },
    {
      "id": "file_1",
      "created_at": "2026-06-24T09:13:30Z",
      "kind": "file",
      "policy": "referenced",
      "path": "/Users/me/byteowlz/ctx/Cargo.toml"
    }
  ],
  "warnings": [
    {
      "code": "permission_denied",
      "message": "Screen recording permission not granted; screenshot omitted.",
      "item_id": null,
      "created_at": "2026-06-24T09:13:05Z"
    }
  ]
}
